title,category
 re all genius,1
what s the space fill with,1
restructure of physics undergrad a dialogue,1
help please,1
think of get a phd in quantum mechanic,1
what be the motivation behind uncertainty principle,1
need help with free body diagram or  be go to fail physics,1
help,1
how do i use the physics package with latex specifically in texshop,1
do i understand relativity right,1
how much power to freeze water i have work and need time,1
greens function use before dirac,1
use paper to trap a ball,1
ap physics   question,1
gravitational wave interference,1
textbooks   amp   resource    weekly discussion thread    january  ,1
hello everyone  ,1
twitch effect   do this prove data speed be fast,1
can  create plasma with electromagnetic force,1
when linearize a data point of an inverse relationship how do  uncertainty change,1
would  feel centrifugal force different in low gravity environment like ie moon,1
confused   how do i study with efficiency,1
confuse as to study,1
suggest resource for computational physics simulation,1
hello guy  be take part in a raman spectroscopy student research forum at a university and  be hope for  advice,1
planck unit,1
what be the galaxy sun,1
what be reality,1
how do  know what  know,1
spacetime metric equation,1
penguin waddling,1
q   size of a photon qm explanation only please,1
please help with this problem,1
buffer stop problem,1
why do voltage increase cause a current decrease in a transformer,1
how should a computer scientist learn physics,1
can someone help  solve this question plz,1
why be an eclipse need for eddington experiment to prove relativity,1
please help last minute,1
landau level in python,1
computational physicist how do  start,1
msc in gw physics or astrophysic,1
msc in gw physics or astrophysic,1
question about light,1
mcgill vs   northwestern grad school,1
advice need,1
what to do in time of self doubt,1
have anyone hear of the popular   reality shift    trend on tiktok,1
be quark fundamental particle,1
graph interpretation,1
be calculus a branch of physics,1
horizontal velocity be,1
can  survive a   foot fall on pavement,1
would  be cheesy if i name  cat alice and bob i want to name  something physics relate,1
study physics,1
how do keep a temperature probe still in an electric kettle affect  temperature reading,1
time dilation    flash and ender game series,1
the force of a fall motorcycle,1
paradox contradiction,1
job after m sc in physics,1
a relation between physics and ancient ontology heideggerian,1
a bee fly in a car,1
wine glass rotate opposite direction of swirl motion,1
can anyone explain spacetime to  as if i be a fifth grader,1
measure if the speed of light be the same in all direction,1
problem,1
fourier transform and derivative,1
ap physics work question,1
percentage of dark matter in the milky way,1
help ,1
resultant amplitude of   wave,1
what be the significance of    ,1
the road to reality,1
if the universe be create from no space and no time what s outside of the expansion,1
what do a typical day of theoretical physicist look like,1
be  possible to teach  general theory of relativity,1
how to algebraically compensate the air friction to get the position of a bounce ball in vacuum,1
be chaos theory more math or physic,1
need help asap,1
how to compensate the air friction algebraically to get the position of a bouncing ball as a function of time,1
bernoullis principle and newton   law in regard to lift,1
a little question i have just curious   at which distance would  have to be from the earth in order to be attract by the pull of the earth and the moon equally,1
physics question    weekly discussion thread    january  ,1
need advice for solve physics problem,1
i have a weird question,1
help,1
 be not much of a physics expert but i really want to know,1
principle of transmissiblity of force,1
easy question from dumb student,1
i need some advice as an undergraduate physics student,1
what physics program class should i look for,1
spring problem,1
help with a project,1
resource to learn electronic,1
the new arm race   hypervelocity projectile,1
why be not a farday cage invisible,1
good textbook to learn physics from,1
opinion about a recent book by h   nastase introduction to quantum field theory,1
  theory   passage of time   ,1
confused about rotate frame of reference,1
what be there before the beginning of existence,1
physics help need desperate kinda    ,1
be there a type of gyroscopic valve detail in description,1
new to everything,1
happy birthday isaac newton,1
literature about oncology physics,1
should i drop  current electivein which i be interested in and take the one where i can score easily,1
why do a handle of a mug sometimes get hot in the microwave,1
good undergraduate level and above astro physics book,1
class help,1
i draw  graph digitally with and ipad pro and apple pen but  prof doesn t accept  graph becaus   i have to do  manually,1
what be  work on    weekly discussion thread    january  ,1
theoretical application of neutronium besides planet destroy bomb,1
torque vs horsepower,1
how to calculate the force a wheel deliver,1
pressure in a pipe,1
transformer    how would i go about turn   v dc into   lt   volt,1
  thought experiment   if a quantum computer give  the exact date  will die on do know this information change the date,1
rub   chicken together,1
how be the mass distribute in universe,1
hi be there a site that have physics problem i can solve to test  knowledge of a subject or practice one,1
semiconductor,1
how to get involve in physics research under present circumstance,1
speed of light,1
schr dinger equation with zero calculus,1
will any physic please help  with this,1
what do learn the way of thinking mean,1
what equation represent the mechanism behind microwave operation,1
i want to make a difference,1
vortex in a glass    sound,1
thread    source for dissertation,1
why do ftl travel break causality where supersonic speed do not,1
study group for masters physics student,1
change in density,1
who in  opinion be the great physicist in the post einstein era,1
if move sufficiently fast can  become a black hole,1
misunderstand uncertainty in the einstein quote   do that mean the moon be not there when i be not look at ,1
question about pressure,1
if there be a hypothetical room where all quantum particle within  be constantly measure indefinitely would  be possible to freeze something in time   base on the quantum zeno effect,1
how do transparency work for all wavelength,1
voltage,1
impact force,1
what be the slow speed possible that isn t,1
look for a series of video about fundamental of physics,1
do multiple reality exist simultaneously,1
physics job with only a bs,1
copenhagen theory,1
i have define the m theory fractal equation   not sure who i be able to discuss this with,1
non professional idea how anything exist,1
why be i only interested in some branch of physics,1
a beginner friendly physics book,1
arc reactor,1
physics book that help understand tenet,1
necessary prerequisite,1
how be   observer   define,1
a question on quantum physics,1
fine tuning of the universe,1
i have a physics question,1
predict the location of shattered piece of glass,1
dobble slit experiment,1
what s the difference between hibbeler statics   amp   dynamic and taylor cm,1
speed of light question    sending and indication over distance,1
what would happen if the universe be   large,1
i need help with physics any recommendation please,1
double slit experiment,1
sit practice test,1
magnetism in a vacuum,1
textbooks   amp   resource    weekly discussion thread    january  ,1
be there a limit to the mass size a celestial object can have,1
be earth a capacitor,1
textbook recommendation for undergraduate pde,1
kinetic power or what,1
effect of speed on a grinder,1
what would happen if  could contain a massive explosion,1
brain processing of sound wave,1
would a mass human exodus from earth create enough of a change in mass to alter earth s orbit,1
would an object spin extremely fast in zero gravity attract other object that be large in size,1
have anyone demonstrate a work quantum gate which can reliably manipulate qbit without lose entanglement,1
datum table format question,1
be i properly apply the de broglie equation,1
can thunder melt car tire,1
system of fly in a car,1
look for anyone between  ,1
look for at home education,1
property of color of light mix,1
can someone tell what this actually will do   wire wrap around a pvc tube around   time connect to a battery,1
viscoelastic fluid and physics,1
what happen with the heat after  compress gas,1
i have a question about calculate pressure inside an oxygen tank,1
physics project   foucault penulum,1
what be the state of  subfield,1
physics question,1
try to visualize planet as ball in jello,1
theoretical question possibly nonsense,1
in  case   be  a good idea to study physics,1
can anyone suggest  some book on astrophysic,1
why alot of people act like  know physics but in actual  do not and just know some random fact,1
be  inherently biased against deterministic theory what if a theory provide a complete description of  universe   require   determinism,1
physics final   p,1
if gravity isn t a force why do physicist still act under the assumption that  be,1
why be gravitational potential energy of a system always negative,1
  discussion   determine the age of two object of different mass,1
sub freezing water danger,1
  question   how do  know there be any distinction between particle and wave,1
centripital acceleration question,1
how do  resolve this paradox,1
metallic hydrogen fuel,1
question about  type,1
 thought on the creation of the universe,1
some thought on   fictitious   inertial force,1
eddy current vs persistent current,1
how do people die in a fall elevator,1
practice test for sat physics,1
be  possible to switch from engineering to physics,1
do quantam physics occur above or below the atomic scale,1
  lattice   amp   underlie code of reality,1
may be stupid question,1
what field do thought occupy,1
why be gamma ray use to determine attenuation coefficient,1
energy dissipation of sound in water,1
math,1
how can i get a phd in physics if  bachelor degree be unrelated to this field,1
can i use a bunch of iron nail as an iron core,1
why be there no flux between cold winter air from outside and hot air in  house when i open a window,1
physics question    weekly discussion thread    december  ,1
physics question thread    week  ,1
photoelectric effect light source,1
pronunciation,1
what beam frequency and intensity for resonant breaking of sio   bond in rock matrix,1
physics question,1
forward move flashlight vs stationary flashlight would the light hit target at the same time,1
how would i calculate the g force of a car with perfect traction,1
how effective would a mirror be at deflect a strong laser like something use in commercial metal fabrication,1
do photon make patter when  hit each other come from all different direction in the air and have anyone ever be able to detect these pattern,1
fall from a great height into water while in a convertible car,1
heat stress glass,1
research in theoretical physics,1
optics homework,1
optic,1
try to solve the big question be i waste  time,1
relation between elasticity modulus and coefficient of restitution,1
a question here stupid one,1
the relation between the elasticity modulus of a bounce ball and the coefficient of restitution,1
gamma ray bust hypothetical question,1
observable vs know universe size,1
what be  work on    weekly discussion thread    december  ,1
will the pendulum stop,1
human consciousness energy reset,1
from a learn physics pov what do  wish  have hear or read or see in a video lecture early that would have save  a ton of confusion,1
  question   veritasium have a video on how  talk about why  do not know if light travel at the same speed   can this be a solution below,1
university priority help,1
quantum mechanics entanglement,1
be  possible to determine the practical answer of the problem   a coin drop vertically take    sec to reach the ground what height be  drop from,1
how be black hole form,1
what be the likelihood of get accept into a top   phd program,1
earth rotation question,1
in the everett interpretation be there an infinite number of world or just a lot of ,1
idea for an online simulation that incorporate stefan boltzsman and wien law,1
korean sun kstar energy output calculation question,1
in the everett interpretation be there an infinite number of world be just a lot of ,1
multiverse,1
discuss ndfeb magnet behavior in a controllable vacuum,1
what be the dissipated power on the furth right current generator,1
just a thank,1
the physics of glass fill with water,1
einstein theory of relativity wrong prove  wrong,1
do the equation dp dv    ek have a useful meaning in term of physics,1
how do i study for analytical mechanic  be in high school and  like  dream atm to study analytical mechanic,1
question about time qm and the big bang,1
what s the interpretation between greens function and propagator,1
be  possible infinity doesn t exist,1
quetionorchestrated objective reduction,1
good way to learn physics on the internet in,1
good way to learn physics on the internet in,1
   and   generation particle physics,1
do anyone have an opinion about the janus cosmological model,1
interesting commonality between statistic and entropy and quantum mechanic,1
where would  find severe sideways horizontal turbulence the type of turbulence that s dangerous to airliner,1
why can  not light a match in a tunnel,1
need syggestion for wave book,1
rotational energy of earth be a billion time great than  annual power supply,1
a question for people smarter than ,1
classical quantum mechanic and planck constant,1
look for solution manual no answer in the book for  to check,1
wanna hear a joke,1
bizarre challenge question,1
good physics   youtube content,1
please educate  about time travel,1
conservation of energy,1
energy of a photon after the slit,1
if  be possible to know the wave function of the whole universe   what would  really learn,1
try to fully understand the concept of electric potential,1
six easy piece by richard p   feynman,1
can dark matter be just curve spacetime,1
i have a theory what dark matter be,1
i m have real trouble with the relationship between the   beginning   of the universe and the   law of thermodynamic,1
possible investigation use blackbody radiation,1
idea for high school simulation,1
if there s an exhaled airborne microdroplet that someone exhale    ,1
doppler velocimetry for blood flow,1
anyone feel like frank wilzcek will win another nobel prize,1
any book recommendation,1
  q    be a layman who recently hear about conformal cyclic cosmology and have a question   where do the mass for the next aeon come from,1
mini tesla coil circuit diagram anyone,1
choose a doe lab for reu,1
 have watch every black hole documentary there be on youtube   why do law of physics break down come up in every one,1
cosmologist,1
when hold an object be  feel the weight or the mass of the object,1
experimental physicist what engineering knowledge or skill  wish  know before start  phd,1
damped oscillation frequency be decrease but why,1
textbooks   amp   resource    weekly discussion thread    december  ,1
textbook   amp   resource thread    week  ,1
what allow a laser to reflect off a wall but not air,1
be make a research on raman spectroscopy or radiation dosimetry maybe costly for a not so financially able student like ,1
quantum entanglement question,1
the double slit experiment,1
anyone not celebrate christmas and willing to explain some stuff to a newbie,1
do quantum fluctuation not have a cause,1
do meteorite actually vaporize on impact,1
how much force to kill a human with the follow attribute,1
be posible to redirect a narrow with a kick,1
why do  think thermal paste place in an x pattern be the good for cool,1
aluminum and soundproof,1
graduate course radiative transfer cross list,1
resource for daily update,1
regard instantaneous acceleration,1
optic,1
car crash theory,1
tutor need,1
i have a quick and dumb question about tug of war,1
do any one take a ideal gas can  solve this,1
please help,1
what would be the theoretical concequence of create destroy energy,1
ressource on the history of physics and especially the experiment that adance physics,1
if different color be a result of different wavelength and wavelength be determine by energy why do increase energy on a lightbulb make  bright and not change  s color,1
time dilation of    million year,1
undergraduate literature research,1
what kind of effect would an extremely powerful magnetic field have on earth,1
try to comprehend special relativity question,1
can not resolve  understanding on datum current relationship in computing,1
i do not know what career to get into with  physics degree   ,1
how far do reflection travel,1
if  shoot a bullet that impale through everything like wind water building people and etc     would  go so fast around the earth that  leave the orbit and expand as  revolve around the earth,1
be naked singularity have infinite mass,1
weather control,1
suggestion for subject to learn,1
could  measure the velocity and position of an electron by bring the atom down to absolute zero,1
puff bar plus problem,1
gym weights size difference,1
string and pully,1
be human body ultimately determine by the law of classical mechanic and electrodynamic,1
question,1
 a question of time   ,1
q   speed of light travel be almost certainly not the future of space travel what be and how do  overcome the time aspect of live communicate with each other on multiple planet,1
physics answer to why polarized sunglass work,1
just   fail    first semester of grad school,1
how do i interpret the probability arise from schrodinger equation,1
help  with a question,1
 question get delete so i ask again   what happen when one sing and accidentally hit the eigenfrequency of   body would one evaporate or what would be go on could one explain that process step by step,1
i think the concept of time dilation and special relativity click for  last night can  please confirm  explanation,1
interesting physics paper,1
question for ap physics b teacher or physics teacher who teach non calculus physics   in college,1
which skill should i be pick up in the next few month,1
i need help with this question,1
do a cell phone emit more strong radiation surf the web use app etc   use wifi or   lte,1
can magnetic pole be on equator,1
who build large experiment,1
what be the new trend in physics,1
negative vs positive work,1
how to find out the state of the research field  be interested in,1
be light wave sinusoidal,1
lguvgrnhet,1
i have an assignment and i be wonder if  could help    thank ,1
physics question    weekly discussion thread    december  ,1
be a switch from biochemistry biotech to physics biophysic at a well university worth ,1
physics question thread    week  ,1
multiverse ponder     a god must exist  ,1
what would a the inside of a reflective sphere look like,1
wavelength,1
classic text on quantum mechanic and where to find ,1
why be there so much hype for yesterday conjunction,1
what exactly do physicist enjoy about physics if  be aware that physics model be not necessarily the reality of nature,1
physics question from an anime nerd,1
why be stre theory develop,1
how many year will take  to start with physics from scratch until i become a physicist,1
hello i be in   grade and i have a passion for physics,1
i be interested in physics where should i begin,1
 teleport accidentally to the bottom of the mariana trench what happen next,1
nucleation seed for vacuum decay,1
advice need please    astronomy radiation problem,1
explain to  escape velocity,1
college physics,1
adhesion question,1
i have a report due in   hour and i still have no clue what  want  to do,1
help plz,1
i do not know if whether i like physics or not,1
would a   dimensional be experience gravity,1
what be  work on    weekly discussion thread    december  ,1
what happen when a quantum entagele partical fall in a black hole,1
greenland   film meteor prediction inaccuracy realistic,1
   year old ask  a question about why chestnut explode when  re heat up on coal,1
maybe not the good place to put this but what do  all make of this quote i see on fb,1
be this too many class,1
be exotic energy like in the mcu real anywhere in the know universe,1
look back in time,1
i have a physics relate question,1
grand infinite race,1
take a year off what can i do on  own time,1
could  mom s alcohol have freeze without water,1
pay to take  exam,1
physics major,1
a breakthrough update,1
project idea for physics    ,1
any artistic form in physics   ,1
i need help,1
how do i find a phd,1
schwarzschild radius,1
physics final need help deadline   hour,1
academic writing service,1
what be the velocity of sound in air at a temperature of   c give the speed of sound in air at   c be   m s,1
if the universe be truly infinite should not that mean  should be an inhospitable place with infinite gravity everywhere,1
dae notice that discussion about the foundation of qm and what  really mean always involve the non relativistic formulation of qm,1
could  be possible for white hole to be concentrate exotic matter,1
where do electron go at the end of a circuit,1
physics of rotation in a human body question,1
a question about relative motion at near light speed,1
question that have plague  throughout  year in learn physics,1
what would happen if  turn on one of the cern superconductor magnet in a suburban garage,1
physics and electromagnetism,1
fall off a   cliff,1
schrodingers box,1
derivation of velocity from acceleration with functional equation,1
the double slit experiment,1
what be outside what  consider the universe,1
time travel    visual from the past possible theory,1
if i want to prove a multi variable mathematical model use an experiment but i could not control all the variable that be traditionally suppose to be control how should i design the experiment,1
a question about orbital rate,1
do transistor have a resonance frequency,1
just a question,1
textbooks   amp   resource    weekly discussion thread    december  ,1
what do  think of journal with strict length constraint have very high impact factor,1
string theory question,1
have a little trouble understand centripetal acceleration in relation to velocity,1
i be look to study physics for personal knowledge,1
presidential letter   defend aps core value   amp   executive order,1
   health physics    anyone who have some topic in mind for a thesis proposal which  think would be interesting to research on,1
how do  calculate net electric field use vector when the electric field line do not even intersect,1
read recommendation,1
can anyone help with an issue with classroom experiment involve camera,1
how much force be an object propel by an open airlock in space,1
why do physicist say that an extensive entropy be proportional to the volume,1
never good at math science i may have to take physics class advice,1
question about black hole,1
constant acceleration to reach the speed of light,1
way to learn e amp m,1
cricket physics,1
antimatter,1
do take differential geometry in undergrad help for astrophysic grad school,1
how to advance in physics,1
anyone here work at cern,1
expansion joint,1
help with a   rocket project,1
how do  measure the exhaust acceleration from a nozzle,1
look for answer on slide weight vs lift weight,1
physics energy,1
look for someone who will help  study physics   like a mentor,1
anti matter,1
be there any simulator app software for mechanic of body,1
do the difference between mass and gravity center of an object which be currently on earth increase or decrease when  go to moon,1
i do not like physics in high school but i like math   should i take physics class in college,1
somebody please help    i can not keep up anymore   thank ,1
be be a theoretical physicist a good career option,1
i have a question about the speed of sound,1
what happen when  pass by a window in winter and  can feel cold radiate,1
i could be wrong but this be what i think just a theory,1
culminate physics podcast,1
ap physics lab,1
be  possible that the big bang be be actually the end of the universe and what  perceive as move forward in time be actually backwards towards the big bang,1
i don t understand this,1
idea let  know why this do not work,1
speed of a rock,1
a question,1
can i find a job relate to  physics degree i do not hate,1
any good resource on the physics of melee weapon,1
be castel correct regard  criticism of newton view on prismatic colour,1
how do i calculate the gauss bonnet equation from a variational principle,1
question about a hypothetical equation of state,1
be be a theoretical physicist a good career option,1
physics books recommendation,1
look for a medium    beginner level physics textbook,1
good online course in quantum physics,1
physics question    weekly discussion thread    december  ,1
aerospace or theoretical physics for graduate school,1
physics question thread    week  ,1
if an proton be trap inside an sphere make up of charge q   if force exert by q increase by time will there be a point where this charge q will breakdown into quark or  constitute particle,1
easy to understand text on general theory of relativity,1
i need help regard zeta potential,1
half life,1
thermodynamic change in internal energyhelp,1
how would anti matter be store transported,1
help a high school student,1
what do  consider to be more fundamental   the hamiltonian or the lagrangian,1
hypothetically speak,1
be apparent weight proportional to normal force,1
question about fall speed,1
in the double slit experiment how be single electron be measure,1
any book idea,1
hypothetical load cell question well kind of hypothetical   ,1
a question about newton law,1
book that  still use,1
i apologize for bothering but i need help,1
