title,category
how do i get well at study physics,1
a dime for  thought,1
question about force of fall from a move vehicle,1
infinite and the scope of the multiverse,1
could the centre of earth have   gravity,1
question about the component of gravity,1
can a fly stop a car,1
 be have a hard time with advanced physics on college,1
help please    ,1
textbook   amp   resource thread    week  ,1
where do the vast amount of ice come from when  freeze a sealed bag of veg,1
flux pinning question,1
what be nothing,1
i have a physics question about litre and air,1
the infamous problemkinematic,1
what be the formula for when two large object planet hit each other,1
be this a good time to start learn physics,1
question on matter antimatter and dark matter,1
lead brightness help,1
why can not heavy atom emit particle like hydrogen nucleus or lithium nucleus,1
question about e mc,1
can someone please help  with this hw problem,1
 teacher never teach  how to do a question like this and  be confuse   would appreciate an explanation,1
firework and bernoullis principle,1
geger counter and radioactivity of object,1
book for beginner,1
moment of inertia and ke,1
do  ever just zone out and realise that  exist and  start trip on  own consciousness,1
recommendation for study and learn electrodynamic   from the book electrodynamic griffith,1
what do the feynman method talk about,1
how wrong can geiger m ller counter be,1
where do i start,1
mouth be control,1
be there research job in physics in the industry,1
take mushroom and want to change einstein s theory,1
physics for a four year old,1
help with  computer science project,1
be einstein s relativistic velocity addition commutative,1
the wh question,1
boundary condition in quantum mechanic,1
how do  convert real time to imaginary time,1
how do  convert real time to imaginary time,1
  meta   be there a physics subreddit that s strictly limit to peer review article,1
can  still move if frictional force be great than apply force,1
absolute frame of reference,1
conservation of energy and projectile motion,1
look for advice for grad school,1
help with physics,1
could  build a supermassive structure in space,1
frustrating stuff,1
help  debunk a conspiracy theory,1
enquiry regard to expand knowledge,1
popular romantic connotation of dirac equation,1
look for idea for  matura project gymnasium graduation project,1
gravitational wave from binary neutron star systems,1
any recommend textbook,1
 can not know the velocity of any object or particle exactly,1
simple question hs level physics,1
what s something that can not be categorise in physics,1
quantum effect in large object,1
drop the class,1
what happen to the feynam documentary no ordinary genius,1
seek help with a flat earth family member,1
first law of thermodynamic and the big bang,1
electromagnet,1
resource that help ,1
electromotive force from    equation,1
invitation to join in quantum interpretation subreddit,1
light energy help,1
hi this be  hesitation but  will be short and directly to the point,1
i need some help,1
can angular velocity break the sound barrier,1
would someone be able to properly explain nuclear fusion,1
relationhip between wheel circumference and horizontal displacement of a wheel per revolution,1
waveform visualization in music and in reality,1
perpetual motion key,1
conservation of mechanical energy,1
be there a way to measure uniformity or disturb ness of wave on a   plane,1
how will online school impact gradschool application,1
power heat and efficiency,1
power heat and efficiency,1
seebeck effect in a nutshell,1
why do the color appear recursively when photograph an lcd screen with flash,1
electron spin,1
how loud would a supernova be and how far would the sound go,1
deadline tomorrow,1
dear physicist how do  get where  be now,1
universe be alive,1
why can not  fix voltage at specific number,1
why can not  manipulate with voltage,1
need help decide  major,1
cigarette smoke jet stream through  apartment window from  upstairs neighbor,1
physics question thread    week  ,1
can the string theory reveal all the secret of humanity,1
nuke phys,1
lab experiment,1
be free fall as prescribe by isaac newton truly feasible,1
if the universe be always expand so  be as good as infinite isn t  almost guarantee that parallel universe exist,1
what effect do varying level of radiation have on electronic like in cell phone,1
as an object fall   meter in   second what be the acceleration,1
struggle in physics,1
help physics homework i understand nothing,1
what do  think of bruce gernon tardis plane,1
guilt from take a day off study,1
book resource to self study physic be a math major,1
can i simulate distance use a series of mirror this be drive  crazy,1
 be fail physics how do i catch up,1
i need help with this physics problem,1
i need help for physics,1
oh stor,1
have trouble with loop and classical physics,1
virtual particle wave duality,1
quantity define by mathematical convenience in physics,1
significant digit,1
 be lose  good friend to a pseudoscience rabbit hole,1
thought on college physic vs universityphysic vs physics resnic halliday walker krane,1
hep   how to use at good inspire and the arxiv,1
beginner friendly book article about superconductivity,1
theory of everything,1
what be cause  sun to move through space at such a high speed,1
why be si unit of time on the order of   and not,1
be  possible that hawk radiation be a cause of global warming,1
software for create diagram,1
would  be reasonable to assume time may be a   sphere,1
how difficult be a career in physics,1
be  possible for inanimate object such as fan to suddenly start talk,1
confirm deny critique  thought on information and entropy,1
in a rough sense can  think of jerk as the velocity of the acceleration and the snap jounce as the acceleration of acceleration,1
why be momentum conserve,1
thought on college physic vs universityphysic vs physics resnic halliday walker krane,1
science be too literal and religion too vague,1
what do this mean,1
do the object that move weigh less in this situation,1
book like the chicken from minsk,1
find total flux of earth magnetic tield,1
how to calculate the maximum altitude of a rocket with instantaneous sensor datum,1
quick question,1
why do  shielding need to be ground,1
mathematical physics vs theoretical physic,1
if there be   dimension to reality then should not there be zero dimension to reality,1
an interesting similarity,1
i would like to hear  thought    do  think if time be an unknown big aspect and physics can distinguish if  be go to the future to past,1
anti particle,1
heseinberg uncertainty principle,1
need help find what to study next,1
education delimma,1
 motivation to study physics,1
what be gravity,1
need the   version of what happen to energy in the universe when  inevitably end,1
quantum physics experiment,1
physics undergrad need every tip  can get,1
paper on the universal speed of light,1
application of schr dinger cat i think,1
be  ok to publish pet theory on r physics,1
if pulsar be make of neutron why do  have magnetic field,1
be algebra base physics tough,1
reverse engineer a time travel dolorean,1
an unimaginable telescope,1
constant velocity,1
uncertainty of analog device vs digital device,1
look for recent publication,1
time dilation question,1
how do  know if  truly understand physics,1
bibliography request on how electricity work from a physical point of view,1
human be the size of ant but earth remain the same size   how long for ant size human to circle planet,1
need help,1
helppppppppp,1
 be have a hard time understand inner product and the notation   lt f g gt   or   lt fg gt   for function   do  have any recommendation where i can learn more about these concept,1
need help with clarification on fluid flow in space,1
a question about some basic dynamic,1
i have a medium sized   hrs week online tutor clientele that i be go to have to leave in the next week to start a new job   i be look for someone qualified to recommend  to,1
startup idea for a physicist,1
what would the motion of an object that be slip without roll look like,1
emf of a cell,1
electrical question,1
be the deep sea literally the past,1
do the double slit experiment insinuate infinite universe,1
i just realize how the entire universe work,1
be measure light possible,1
look for the paper on propose fast than light travel use a dimentional traversion   from around  ,1
could a material have a different speed of light when go in opposite direction,1
uncertainty in time measurement,1
astronomy question,1
colour    what happen at the atomic level student confusion,1
how could i go about visualize the change in air composition   vs   over time for a   person in a seal room   scenario,1
be this an accurate understanding of relative time,1
easy electromagnet wave sensor,1
easy electromagnetic wave sensor,1
help with friction coefficient,1
vibration frequency,1
physics question thread    week  ,1
kangaroo question please be nice,1
if an immensely dense sphere be drop on solid ground would  sink through or shatter the ground around ,1
the mass of light,1
if light pass through a medium such as diamond and  speed decrease do  come out with a less speed than the original or do  retain  original speed,1
i want to properly learn physics and math,1
consider physics,1
can i get a master in mechatronic if i study physics,1
if length contraction can occur why can not length expansion,1
fall physics question,1
  motion,1
do cylindrical tank drain exponentially,1
what be some good physics experiment,1
be the job market for the industrial physics researcher as bad as in academia,1
be einstein the only person in the history of humanity who be able to formulate the theory of relativity,1
a complete guide to master physics,1
when do soap bubble coalesce or bounce,1
gauss law in time dependent electric field,1
comparison between mathematica and maple,1
do temperature effect the blast of an explosion,1
frame of reference,1
if a planet fall into a black hole   ,1
get demotivate,1
thing,1
be time really continuous,1
question   ice cube vs actual rock,1
higgs particle,1
never take a physics class before and need to take physics   with calculus lab in college   be this doable,1
ap physics   exam,1
where to start to understand quantum,1
quantum distance,1
the invariant mass of the electron    calculation,1
how do everything  know start,1
einstein,1
biography of einstein,1
why do power require increase as a force accelerate a body,1
why do a car engine apply a constant force use increase power,1
astrophysic binary star question,1
why be silk static and cotton be not,1
interested in theoretical physics but  d also like to see theory be test and implement in real life,1
would a theoretical physicist be able to create hardware some device if  develop some theory that allow for ,1
physics of toss a coin,1
each person be an arrangement of atom    be the maintenance of this arrangement that be important and the same person continue to exist when individual atom be replace by other atom   what be unique about each person arrangement of atom,1
i have two question about the magnetosphere of earth,1
sound barrier and rotational motion,1
singularities and einstein calculation on the expand universe,1
gre   pgre for fall   application to astronomy phd program,1
hey folk i have a question regard measurement unit,1
curl and conservative field,1
do entropy apply to space time,1
i think i may have find a way to find if light be really constant at both direction   i would recommend  to watch late veritasium video on the speed of light for context if there be some problem understand ,1
 be only possible to know the   way trip speed if light     because of a while bunch of reason but if  know the roundway trip speed of light  be just as possible that the speed of light in one direction be the total   way trip speed and in the other  be infinite instantaneous    question,1
want to study medicine then why the physics,1
optimal pee spot,1
uncertainty help,1
to a rigorous physicist who understand climate science in detail,1
delta correlate noise source,1
pls answer this question for ,1
when lightning be discharge from the sky do that area experience a significant drop in temperature,1
how do  figure out what to apply for in grad school,1
material research   cheapest light softest most impermeable and durable material to store helium  inside,1
positive feedback loop in climate model,1
why do not  people in the us measure  bodyweight in slug instead of pound while europe measure in kilogram instead of newton,1
flywheel launch speed,1
can  cover   year of a math major curriculum in a year,1
can anyone answer this real quick,1
aren t colour just an illusion,1
question about force,1
what word or mean best describe a computer read the content of a wave,1
help with solve a work equation,1
be  accurate to say that gas have no bond between the particle,1
textbook   amp   resource thread    week  ,1
question,1
free resource to make  like physics again,1
what be the ideal gas law equivalent for a fluid,1
question about momentum,1
physics of a football in air,1
too little programming in  department   like just   course and some telecom stuff   anyone in similar position  just seem wrong to ,1
what be the   bad   physics textbook,1
please help dumb business student ty,1
projectile motion,1
photoelectric effect question,1
question,1
internship help please,1
physics hw help please,1
what s the conjugate variable of phase,1
 can not test ,1
world wide enginequite the ingenious solution to a problem that s plague human since the caveman make fire,1
what be a force,1
be the velocity of the earth move through space add to the velocity of a fly airplane,1
what be the purpose of neutral in ac,1
can anyone recommend a book which teach the physics behind roller coaster,1
i need help with  project can someone help,1
do  ever feel like leave  all behind right before a big physics exam,1
how to stop a bullet,1
i be currently a freshman and be really consider be an astrophysicist when i grow up any tip,1
can someone recommend a physics book for beginner,1
remove post,1
obtain an unknown interfacial tension,1
how to fall in live with physics,1
this be probably dumb but i can t figure out how to solve this problem please help  s short,1
i regret major in physics,1
atomic decay affect by atomic mass,1
learn general relativity engineer    text need,1
how to become a nuclear physicist,1
question for those who take a joint math physics degree   ,1
what would happen if a person be hit by something the size and mass of a grain of salt travel at the speed of light,1
instrumental wave,1
age and time dilatation,1
thermal conductivity,1
black hole information paradox discovery discussion,1
do curl hair have a spring constant,1
in doppl effect why  not the same when the source listener be move with a certain speed towards a stationary listener source,1
learn about time and space,1
can  observe time dilation and length contradiction at the same time,1
how to take physic note on computer,1
i need help understand the quantum description of time,1
physics question,1
thc and blood oxygenation theory an interesting title,1
what do  know about the higgs boson,1
foucaults pendulum equation,1
can i learn more physics from feynman lecutre,1
way to determine frequency of ac genrator,1
absolute value debunk time travel,1
would time travel violate the mass energy equivalence principle,1
be  theoretically possible to simulate a volume v of space with a computer of an equal volume v,1
debunk theoretical time travel,1
water question,1
ionization energy in relation to heat,1
what can i do outside of school to strengthen  chance of a post bach bachelor and then graduate school,1
help on a question,1
physics question thread    week  ,1
theory of chaos,1
speed of light question,1
someone past could be someone else future,1
tutorial for   ray tracing and light scatter on droplet,1
if x ray be on the electromagnetic spectrum why do  not have lense to focus  like  do with optical light,1
how fast to light speed,1
be  possible to become a child prodigy physicist,1
in what way be time not linear do time exist before the big bang,1
how do a computer internet or router physically encrypt information into particle,1
equation for solar panel help need,1
question about underwater pressure,1
what equation can i use to make an object move around a circle with a radius of   at a constant speed,1
be human enhancement and modification in an adult human physically possible,1
i m play a dnd game with a very particular world design and i m curious about how  would have to function to work,1
advice,1
books recommendations,1
a question about atom,1
in what way would i go about solve this problem,1
to those in college grad school majoring in physics what should i realistically expect,1
water bottle rocket calculation of force,1
backwards doesn t exist,1
spacetime,1
physics equation and unit,1
a kind of scientific philosophy question for  physics folk,1
most fundamental physics description of a human,1
why can i completely measure a ac voltage when the wavelength of that voltage be much great than the length of  probe wire,1
a solution to zenos paradox,1
what be the equation relationship between viscosity and refractive index,1
can someone educate  about nuclear criticality please,1
help,1
judge the relative quality of physics journal,1
 friend think  can defy gravity,1
what be some good undergrad textbook for classical mechanic,1
will can quantum computing be use for disease tracking   if so how,1
struggle with classical mechanic,1
 space drive,1
quasar,1
about the term at rest,1
advice change research field for phd,1
what s the good ode   amp   pde solver in python specifically pytorch,1
relativity of magnetism,1
more than   dimension question,1
numerical solution for hydrogen atom,1
do i just fix physics   gravity theory,1
be  possible to reverse entropy,1
projectile motion question,1
homework help,1
job prospect for a physics student,1
motivation need,1
need resource to learn physics,1
hubble plot   how be velocity determine,1
find current in electron sec impossibly frustrating physics problem,1
time for a practical physics problem,1
 know what the speed of light be to a high degree of confidence   but how do  practically measure ,1
i can not chose physics major after high school should i major in math,1
  what physical mathematical concept click  mind and fascinate  when  understand ,1
ok  and a friend be discuss the velocity of light,1
what to learn for quantum computing technology research usage and development of these device and what other role exist and what do  do,1
a weird thought i have while smoke,1
thermodynamic    help,1
how to learn the math necessary for physics as a high schooler,1
a little help for greece,1
when exactly do the velocity of a cart change,1
how be the universe even possible,1
qft and string reading group,1
what happen to a photon energy during redshift,1
utility of pade approximant,1
netflix flat earth documentary,1
please help this be for today,1
please help ,1
how do i really understand quantum computing,1
what do i really understand quantum computing,1
measure surface tension at home,1
think about apply for a phd program and look for advice,1
do the past present and future exist somewhere,1
dimensional analysis,1
textbook   amp   resource thread    week  ,1
why do everything behave in a specific way in a constant environment,1
why quantum decoherence be a problem to quantum computing and how what be macroscopic object defy quantum state,1
question about the relation of thickness and frequency,1
please explain this,1
object move on  own     name,1
what field of biophysic use lot of field theoretic approach,1
reference for quantization of the electromagnetic field,1
book recommendation on math need for general relativity,1
geometry or combinatoric,1
please someone help  with this physics problem,1
advice,1
tensegrity table a poem,1
  nobel prize,1
possible to keep up to date with research with just an msc while do a different job,1
job security with a physics bachelor,1
how be the safety distance of    meter to avoid corona virus calculate,1
need an advice,1
help with find the name of a scientist,1
what s the point of charge a fix voltage battery for ex   phone li ion battery with constant    with high v than   which be sufficient for charge,1
disc rotation question,1
be  worth  to send a mirror on a kind of spacecraft to see the past in say a couple hundred year by look at  with a telescope,1
seek information on muonic hydrogen,1
can elon musk think with first principle be more simplified,1
 need to get to the bottom of this,1
a question about   dimension,1
how come i hear that people don t think space be infinite,1
conduct poisson spot experiment where can i find a diverging lense,1
ideal gravity for vehicular racing,1
matter conversion during black hole collapse,1
where to study undergraduate theoretical mathematical physics in canada,1
anyone who prefer the copenhagen interpretation of quantum mechanic why,1
thermography,1
 and a friend be have a dispute,1
density of electron,1
help  understand   causality and quantum entanglement,1
publish an article,1
polaraization of light,1
quantum darwinism vs many world,1
what do thermal equilibrium in the case of a black body really mean and how do the equilibrium condition only allow stand wave in the cavity,1
can someone plz help  with this question,1
be  possible that  be the result of only two universe merging,1
potential entropy,1
fatores humanos e quest es rob ticas no desenho de novas plantas industriais,1
perforated or hollow ball,1
how do i stay motivated to learn,1
relearn physics for gradschool,1
solar system boundry condion,1
the radiation symbol trefoil,1
do anyone know how to calculate the need thrust on each propellor for a drone to hover,1
love physics hate math   a tale as old as time i know   ,1
induction and magnetic attraction,1
i do not get  if earth magnetic field be strong at the pole why do  see northen light,1
a question,1
physics question thread    week  ,1
someone take  physics   exam for ,1
determine whether i be at rest or move with constant velocity,1
for the passionate one,1
measurement of wavelength and frequency of light,1
question   what be time,1
i hate   kill j,1
i have a question,1
glinde plane,1
a discord,1
could helium be the key to life the universe and everything,1
what be the age of the universe,1
time dilation,1
lee smolin and the future,1
 thought tell   future and  have come mostly true,1
historical physics experiment,1
grad school without a specific passion,1
physic question,1
guidance need for potential discovery    who to talk to,1
a question about a concept in coulomb law,1
where can i find good particle physics repository,1
special relativity   do nothing with non zero mass can travel at c imply the second postulate,1
urgent   textbook,1
anyone have the answer key to introduction to biological physics for the health and life science,1
why do  trap bar turn on  printer,1
the concept of gravity not be a force in the general relativity,1
check that people,1
quantum mechanic experiment,1
why do particular color flicker on camera while some do not,1
quantum mechanics book which teach everything from scratch,1
will  ever have a theory of everything,1
  discussion   teach similarity between e field and g field    visualizing resistance as in a g field,1
do  guy ever feel isolate from talk to anyone about  interest and thought,1
gravitational time dilation,1
q   why be there space between matter,1
david morin exercise,1
what will be a good master thesis subject in three year,1
ask  anything german physics student enter third semester,1
super symmetry,1
galaxy s collide,1
data scientist vs academia position ta researcher,1
help   please,1
college job that also help further education,1
a few question about quantum physics,1
breakthrough in phase space quantum mechanic,1
conceptual youtube channel,1
please answer the question below   thank  kindly in advance,1
how can  test if the multiverse exist,1
in schr dinger think experiment  conclude that the cat be both dead and alive till  observe    but the cat be either dead of alive  just do not know ,1
question for smart people about electricity and magnet,1
look at the world through plank scale color glass,1
computer science and physics double major   please help  decide,1
what be some important modern thought experiment,1
why and how do universal constant exist,1
theoretical problem i conjure up   any way to answer,1
just wonder   ,1
what be energy please read before write  off as a low effort post,1
should i give up on major in physics,1
if i pursue computer engineering in undergrad would the door still be open for  to pursue physics in grad school,1
please help  with this question real quick   tell  how to solve  please,1
quantum super position and the big bang,1
force act on a hanging object,1
advice on physics,1
textbook   amp   resource thread    week  ,1
i forget basic thermodynamic,1
intuition or equation,1
deep learning advice,1
look for recommendation on the good undergraduate plasma physics text book,1
why be the motion in classical mechanic always differentiable,1
effect of separation in photoelectric effet,1
i need help,1
can anyone please explain this,1
understanding vs know,1
good physics textbook for self study,1
what kind of job be out of research,1
please help a confused   year,1
  somewhat meta   grad student in cs machine learning optimization look to exchange tutoring session with physics student ideally amo,1
think about go back to school to get a ba in physics with a concentration in astronomy,1
be everyone a little physic,1
what do identify the   law pair mean,1
restore   object by  projection on,1
a quick physics question to settle a bet,1
moment,1
which particle can be use to calibrate a proton detector,1
physics intuition,1
