title,category
if  be choke while drive how fast would  have crash to dislodge  food,1
how can classical force act over long distance,1
guitar strings only vibrate in  fundamental mode right,1
 boggled  mind that in a   universe gravitation and electricity force would scale with   r,1
if  heat a hotplate to human internal body temperature would  still   feel   cold,1
where can i find popular science article,1
unreasonable effectiveness of math,1
why be red light use in darkroom,1
cycling science,1
what be  work on    weekly discussion thread    december  ,1
which book on classical mechanic be well,1
if there be   or more dimension what sign if any would  be able to perceive in ,1
optically active fluid,1
a question,1
slow large object and the dual slit experiment,1
rotation,1
a guy suggest i post this thing here but if  know of a well place to put  let  know also if  can solve   may be able to get a noble idk,1
what be the intuition behind bell theorem,1
what s the name of this geometry thing,1
e mc   full,1
name  favorite physicist who s a woman and why  be someone  find amazing,1
atomic and molecular physic,1
want to self learn physics should i use mit ocw use edx or lewin physics video for the introductory course,1
david j   griffith roast americans in  book introduction to electrodynamic,1
how much energy would i get from a wooden log,1
what be  highschool physics teacher like what be  background,1
can use of earths resource on extraterrestrial project impact orbit and gravity,1
inversion of the arrow of time,1
work experience,1
in newton third law   ,1
be  possible to explain the proof behind the fundamental of relativity without use math equation,1
make a can roll back up a ramp,1
what s the regular salary for an investigator,1
how be physics formula create,1
  question   total newbie be there a way to convert j into n,1
how to find final velocity,1
how to find final velocity for meter,1
a question i should know the answer to,1
be  possible,1
i be so confused   please help  get out of this,1
question about life of a physics student,1
how can i build an electrolysis e tank with an inverter generator,1
quiz test,1
open university,1
the trouble with physics by lee smolin    should i read  without worry  may be outdate,1
can someone please explain the difference relation between stop power and energy deposit in a scintillation material,1
project idea for a high school senior,1
p e t be the same as power work time right,1
what be some of the open problem in  field,1
can someone explain topological defect and monopole,1
i be play with  modeling clay and  get  think why clay merge again when i rip  off while for example a glass do not merge when  break,1
be gravity tangible,1
be there a vector of will,1
dump question,1
be there any high geometric or physical insight to be gain from the differential form version of maxwells equation or vice versa,1
hypothetical projectile motion problem,1
help  pass please,1
tsar bomb in room,1
why do  high education focus so heavily on quantum mechanic,1
theory application of linear algebra technique,1
x ray or gamma radiation    could  in principle be use to sterilize food without heat ,1
ask for some advice,1
college physics,1
black holes physical effect,1
why be electron negatively charge,1
evaporate water,1
any good book on the topic of manifold space particularly hypersphere and metric measure,1
i have a question why can  curve a arrow but not a bullet,1
minimize the rotation of a ball during  fall,1
how many   laser diode when focus into a single point be need to equal the same power as a   laser diode of the same wavelength also focus into a single point,1
textbook   amp   resource thread    week  ,1
to study math physics or astronomy physics,1
mod need,1
study physics during a pandemic,1
i be so tired of all the website with help on problem lock the answer behind paywall,1
be cool gas or warm gas more effective at transmit wave why,1
water power rocket,1
earths core,1
can not travel fast than the speed of light,1
aps abstract    when do  hear back,1
i need some advice   ,1
i m probably    wrong but hear  out,1
watch out pseudo sheldon around there,1
textbook,1
i need help on this problem,1
importance of programming in physics,1
bar soap quantum travel,1
please help,1
at time i wish i be not pursue a physics degree   ,1
trouble with center of mass   ,1
be momentum equal to impulse at a certain time,1
how much elastic potential energy be store in the spring,1
    constant of   n m   if the spring be compress   cm   ,1
do a   kg object with a speed of   m s have the same kinetic energy as a   kg with a speed of   m s,1
how much work will  take to stop a   kg bicycle,1
elastic potential energy be store in the spring,1
velocity,1
what type of energy increase when an object speed increase,1
be there any online course teach this book   serway physics for scientist and engineer,1
confused about gravity,1
what happen if  get hit by shockwave   pressure blast,1
do anyone know how to solve the coefficient of kinetic friction if the fk be not indicate,1
how do research group work in grad school,1
question on newton   and   law,1
question   do an electric vehicle weigh more when charge vs empty e mc,1
newton s third law question,1
mathematical method textbook exercise book,1
possible to safely create lichtenberg figure in skin,1
probably an insane request   a list of all know superconductor,1
derivation of position equation for large angle pendulum with damp force,1
force transfer,1
be entropy independent from time,1
what happen when two mirrored or opposite wave meet,1
kintetic force coefficient,1
can someone pls explain  the difference between mass and weight,1
theory of transmutation,1
the average flow rate of sluice weir and water pumping station,1
change in light and  vision,1
sonic boom,1
question regard fatigue analysis on vibrate column,1
i have a physics question   please help,1
special relativity   wrong as be also agree upon by people who be smart than i mind ,1
how do gravitational wave propagate,1
noob to physics   question about the watt,1
be there any downside to truss,1
question regard light speed spacial travel,1
how can particle be at rest,1
very specific conundrum,1
have anyone ever fall into the floor because of particle placement,1
be the term spinor be use correctly here,1
quantum eraser varient and ftl communication,1
need help find an easy to understand physics book which go through all major concept in physics,1
need some advice,1
could a black hole singularity simply be a stack of boson,1
advice shortcut or helpfull thing that  can recomend for a first year physics studant,1
quantum entanglement question,1
mass moment of inertia,1
if  could ask a student currently work on  phd with particle phenomenology explanation for dark matter antimatter asymmetry    what would  ask ,1
can someone help  with this,1
what be the physically real representation of a sound wave,1
earth magnetic field,1
do time dilation happen exclusively because of the perception of time to  perspective,1
how do  calculate the velocity of an object at an exact point in space,1
physics question thread    week  ,1
probable analogy between force on sphere immerse in fluid and electrostatic pressure,1
hafele keating experiment underground,1
how be the angular momentum of large body relate to that of fundamental particle,1
how much thrust do a plane need,1
   will pay to take  physics final,1
the good physics textbook,1
infinite light in a mirror sphere,1
why can laser get hot by go through a magnifying glass,1
what be the good degree level physics documentary,1
quantum theory,1
  year old    what would be the benefit of an average dumb guy like  learn physics and math,1
   the importance of specialist knowledge in build a nuclear bomb,1
  year old    what would be the benefit of an average dumb guy like  learn math and stem subject,1
self erasing board question,1
be there any experimental evidence that time be any sort of dimension,1
question about electrostatic,1
  speed of light,1
help  please,1
discussion    tenet     gravity problem,1
stoke eintein equation,1
dosimetry after phd,1
question about force production power,1
why block  reddit  last post,1
i need help with  hw,1
double slit experiment,1
physics beginner   where should i start,1
planck constant value,1
how to study   please help,1
acceleration problem assistance,1
helppp,1
theory of time file by g g ramanujam,1
why be gravitational field strength equal to acceleration but electric field strength not an acceleration,1
need some help with a problem,1
roger penrose nobel prize,1
physicist that should have win the nobel prize in physics,1
can i get accept in physics major if  be a blind color person,1
secondary rainbow,1
damage maybe from lhc just a question of curiosity,1
weird question,1
what s  favorite book on the manhattan project,1
i need help with some physics question in regard to electromagnetic induction to magnify emf,1
collapse of the wave function if the particle be not detect,1
understand the event horizon as see from an inertial frame,1
how do  know that the universe be expand fast than the speed of light    ,1
dry ice   why do  present a great risk of frostbite than water ice if both be similar masse at the same temperature,1
question about turbulent flow ran and les model,1
tenet be actually a horror movie for a physicist,1
the scientific law of consumption,1
habitable zone    formula,1
habitable zone    formula,1
wirless charge project with physics,1
why size may not matter in physics   ,1
question,1
guy i have a question about angular momentum and linear momentum,1
entropy   ,1
should i drop out  cs degree and start study over again at a physics course,1
help on physics final exam,1
accord to the einstein s theory of relativity  always talk about time be relative but i ve never hear anyone say entropy be relative as well,1
be these form of radiation harmful,1
do heater cause health hazard or damage to the body in any way,1
satellite,1
how hard would i have to kick a soccer ball for  to have flame on ,1
how do i get into this,1
  lt question gt   can a human become massless and therefore not experience time i have no educational background to be ralke abiut this,1
i be wonder if  guy could help  with this question about how i look at thing in  head,1
do anyone know any resource to check  answer for truss,1
confuse about the paradox that quantum signal create,1
can  help make the   day of newtonma,1
question for the smart people how to tell how much gas be leave in a tank,1
consider this   ,1
how many parallel universe have ever exist,1
can someone help  with this physics question,1
what be historically and physically the difference between the study of matter and the study of time,1
if black hole can bend light then would not  make sense that  be actually just orbit of light,1
textbook   amp   resource thread    week  ,1
nano science and technology exam help,1
gr research,1
suggestion,1
need help in understand some math,1
should i do a double major in math,1
do physics have many research postition in the industry,1
be the universe become less isotropic and homogeneous on a fix distance scale over time if so how do this agree with thermodynamic and the eventual heat death of the universe,1
light through atmosphere of different density,1
how would i linearize y  ,1
please recommend source for nuclear physics statistic,1
how to make the switch to python as a matlab addict,1
what book be good for clear  theoretical concept for ipho,1
classical mechanic textbook,1
what be the geld strength,1
what would happen if a grain of sand hit the earth at   time lightspeed,1
how would  change the spring constant of a material,1
sorry if  question be silly,1
get any idea for an at home physics experiment,1
photon,1
how do i get good at physics,1
be this a paradox,1
if  shoot a bullet straight up how high would  go,1
 be   and i just try  first thought experiment    about the energy need to heat the ocean by  ,1
how the internet work,1
electron diffraction double slit in a cloud chamber,1
please help,1
job in astrophysic in the eu,1
need help on physics exam tonight,1
thermocouple o   question,1
should i stay in physics,1
can anyone help  with some physics problem,1
why do not  fall into sun,1
heat pump by turn on off conduction,1
question about electrostatic,1
anybody that s really good at college physics wanna make    pm ,1
what be the most popular cosmogony currently,1
suggestion require,1
interesting stuff in quantum optic that can be study work on by an undergraduate student,1
question about gravity,1
be  possible to generate a form of electromagnetic wave that would knock people out or cause temporary inability to perform for humane purpose,1
be  possible to control the shape of a prince rupert drop could  be make into say bullet or mug or      anything,1
homework help   linear acceleration,1
spin planet collide,1
can a physics course in thermodynamic give  sufficient knowledge in thermodynamic without have to take separate thermodynamic course for a dual major,1
question,1
fluid mechanic buoyant force and archimede,1
how be differential geometry use in physics besides general relativity,1
do titanium hold heat well than steel,1
basic question but i do not know ,1
wave transmission,1
why do more neutron make an atom unstable,1
need help with a study guide on the projectiles chapter,1
solutions manual of spacetime and geometry an introduction to general relativity by sean carroll,1
kinematics equation,1
physics question thread    week  ,1
quick question about friction,1
be the fact that light travel in a straight line through lense an argument that light be a particle,1
what   beautiful   physics didn t stand the test of time,1
by what be generate the timbre of the music,1
hologramms and the way  be make,1
  question   should  ever need an angular dependand flux,1
guidance for study relativity,1
force need to turn cupboard upright,1
why do not wifi signal interfere with each other wildly,1
boltzmann appreciation post,1
how do laser rangefinder work,1
when do i use see coulomb law in  everyday life,1
do anyone know this book opinion or,1
how do i think about an electrical circuit intuitively,1
theory idea that need peer review base on gravity,1
if i be have trouble due to    unforeseen circumstance in  upper level physics course if i have any concept question be this a subreddit i could turn to,1
physics question,1
need help for prank,1
need help,1
advice for an initiate,1
textbook suggestion,1
photon s inertial frame of reference,1
how to do physics efficiently,1
the dot product of two vector be a scalar quantity   in continuum mechanic ei ej     ij which be a   order tensor same thing apply for the cross product   what be the explanation for this,1
would keplers law of planetary motion apply to two black hole or neutron star orbit each other,1
why do not the most probable kinetic energy for the molecule of a gas correspond to the most probable velocity,1
i want to make a leydan jar but whenever watch tutorial on how to make one  say i need to connect a wire to ground but what do  mean,1
static cat,1
good quantum reading for normie,1
short rant   graduate  should be a two semester course,1
why do  choose to study physics,1
black reflectiveness,1
i have a theory base on black hole,1
do really a photon or electron behave like a particle in a single slit experiment,1
question,1
do gravity exist in a central location on a planet,1
multimeter analysis tool,1
what dose  mean if the universe space time be flat or orcurve,1
uni have be shit    year be no different   i want to drop out and just get a job but do not know how to apply the skill  have earn through this degree,1
why there be   law of motion while   law of motion can explain  completelyimo,1
late start to a phd,1
have a curious thought the other day and be wonder if anyone do any formal investigation into the modelling the universe as a graph with a set of edge that decay over time,1
  question   what be the efficiency of a carnot engine if there be a heat pump attach to ,1
why can not  go fast than light,1
how do superhero like strength work base on weight and size,1
how do i answer this physics   questionmay be high level,1
how much potential energy kilowatt hr in a   litre water tank that be   metre off the ground,1
why do physicist care about diffraction,1
plank scale decay vacuum decay a,1
light and darkness,1
what happen to the people in the car,1
if some non dissolve able powder in water will  go into air,1
how would radio wave behave in a sphere like medium,1
interference pattern on the macro scale,1
time crystal that repeat over a cycle other than,1
sphere etiology   what and why do physics have to say about why planet and moon develop a spherical shape,1
new to physics and stick on a question,1
ferromagnetism of iron,1
how to turn an insulator into a superconductor,1
i hate physics,1
doubt in partial polarisation,1
someone help  with time please,1
work on a project about mars habitation and need help find some equation on fluidized bed,1
if gibb entropy be more general than boltzmanns entropy why do textbook often do not use ,1
the conscious electron,1
plank scale decay vacuum decay and proton decay via gradual radial growth,1
struggle to advance  problem solve skill,1
the big bang,1
trouble solve this question,1
be force relative like motion,1
what generate lift on a wing,1
question,1
computational physics project,1
ap physics c exam,1
water pressure hypothetical portal question,1
a couple of question about phd application   amp   whether  be good enough,1
grade    version of relativity   i have a thick skin,1
chemical engineering resume   what can i put in  experience,1
can someone help  with this question,1
rotation of a beam due to a torque and newton   law,1
can someone help  with this problem,1
can someone help  with this problem,1
proof that newton   law can be analyse by break force into component,1
roger penrose,1
textbook   amp   resource thread    week  ,1
exercise on luminosity,1
introduction to electrodynamic vs field and wave electromagnetic textbook comparison,1
 physic problem,1
good physics podcast,1
could  diy bounce a laser off of nasa s lunar lrrr,1
perpetual motion,1
the grandfather paradox,1
what be everyone s recommendation for book that breakdown concept,1
can someone who be down help  with something quiz through discord since i don t understand why some answer be wrong at all,1
physics incomplete ,1
first sub physics sub in spanish   r cuantica   s guenos,1
be acoustic consider a subtopic of physics,1
a feynman vr experience   would  be interested,1
field,1
be  any experiment confirm the gravitational pull of light,1
if the light from star take thousand of year to reach earth as time tend to infinity would not the night sky of earth be bright enough from all the start in the universe perhaps only the galaxy,1
question,1
fluid dynamic question,1
the multiverse,1
again relativity,1
what if,1
question on atv axel strain,1
coke in submarine,1
a question about the expansion of the universe,1
weights gravity,1
doppler shift,1
textbook recommendation,1
i need urgent help with  test i hope  understand,1
superconductivity at room pressure,1
i do not understand deep ocean water pressure but i want to,1
   november    anniversary of general relativity,1
energyconsumption in supernovas,1
equation for gcse physics electricity,1
why do newton third law refer to every action have an equal and opposite reaction   why do not  refer to every force acting have an equal and opposite reaction,1
where s the good place to do an experimental particle physics phd,1
which object or geometrical shape would have the big small average air resistance from every any angle in a freefall,1
can quantum entanglement be use to transfer energy,1
physics interview question,1
on birefrigence and polarizing light through an anisotropic environment,1
look for some assistance on the topic of liquid crystal sensor for a project,1
what be the status of quintessence   dynamical dark energy today,1
what impart kinetic energy to the product of nuclear fission,1
the affect that can not angle of winglet have on the drag force act upon an aircraft wing,1
help not sure if this be the right reddit to ask,1
how to jump the furth off a swing,1
get a lot of spare time want physics recommendation,1
the standard model of particle physics   print,1
the standard model of particle physics   print,1
should i add a degree in physics,1
good book on electrodynamic,1
help,1
how can i undergraduate student get some research experience,1
anybody get any advice,1
lens question,1
age of the universe,1
  question   speed of propagation of change to spacetime   expansion vs gravitational wave,1
question from a non physics person   if gravity be strong or weak that  be how would the universe be affect,1
test,1
can anyone help  with this,1
physics question thread    week  ,1
question   why be gravitational potential define by infinity,1
do  feel like  still didn t really understand  field after get  phd,1
 be in   grade and have a really really really confusing question about energy and relativity,1
good physics book suggestion,1
  wholesome post   theoretical physics and experimentalist apply what do  admire on each other,1
i need some help understand cauchys dispersion equation,1
a warning about mass and gravity,1
dark matter and the virial theorem,1
steady state multiverse   amp   the measure problem,1
steady state multiverse   amp   the measure problem,1
steady state multiverse   amp   the measure problem,1
coke and mentos,1
negative thermal expansion of scandium triflouride,1
do physics get relatively hard and hard as  go along,1
hard physics class for undergraduate,1
why be solar system disk shaped,1
how do physicist end p work in software development,1
why be orbital shape the way  be,1
would  be possible,1
feel like i make a mistake choose a physics degree,1
problem   vector addition with different direction,1
tutor need    ,1
exchange particle,1
why isn t the period geo satellite   hour,1
make a water resistant time capsule,1
wavelength in vacuum,1
be the speed of tension same in object with equal density,1
heat death and time,1
help please,1
copenhagen vs cognitive dissonance,1
mri surface coil,1
r physicspaper    new subreddit for discuss publication and research,1
study physics without the pure math   be  possible or can  physicify the pure math,1
question re   basic thermal physic,1
how do  demonstrate coulomb s law,1
can someone recommend book for a a level physics student,1
when will  go to the space,1
resource for learn about semiconductor epitaxy,1
open loop ocean pressure,1
be  bad to graduate in   year i be plan on go to graduate school,1
i can not decide whether i should study physics or engineering,1
i have a question about delta ftn potential well,1
how do i initiate  own project,1
can anybody help  with grocery i know this ain t the place but idk what to do anymore,1
what be be the good physics podcast,1
any good youtube channel,1
can  feel laminar flow through a pipe,1
thought while stone   would measure speed as a ratio of movement through space vs movement through time be of any use in modern physics,1
a good textbook for relearn e amp m,1
i need help with this problem   ,1
gap band in sodium and homo lumo difference   i need support,1
if a space probe live stream a journey to the oort cloud what would happen to the video,1
how do  explain what be a change electric field,1
how ufo operate in  physical universe,1
what s the one thing about physics that everyone should know,1
do science say the past present and future be happen all at once or be time linear,1
physics job,1
black hole theory or be  fact,1
question   magnetic levitating train and air density,1
what be the spring constant,1
physics mnemonic,1
cs law and economic student interest in physics,1
homework help,1
how do  keep note and calculation organize,1
problem help,1
textbook   amp   resource thread    week  ,1
change research area,1
how do the sub field of  msc project affect  phd application,1
how i can calculate this,1
machine learn in physics,1
be buoyancy just a result of gravity,1
why be  so sure that dark energy and dark matter be not the same thing,1
why be  so sure that dark energy and dark matter be not the same thing,1
most influential important paper in quantum information,1
do anyone know why in inelastic collision the inicial kinetic energy y big than the final one,1
good resource for understand the ginzburg landau theory,1
can  find force exert on a meter stick,1
be there any bad assumption make in physics which make  hard for scientist to get knowedge,1
a hole through the earth help,1
vortex,1
switching field,1
physics problem,1
physics in moviesor lack there of,1
help ,1
energy need to add a proton to an arom,1
redditor with a physics degree major and make way above average what do  do and how do  get there,1
question regard space and gravity,1
i hate math but i love physics   what to do,1
a math question   please do not remove in,1
angular velocity,1
compton scatter,1
help,1
constant velocity,1
can a cat survive fall off the empire state building,1
physics question thread    week  ,1
what insight into gravity   theory   have be make since mtw   that would still hold even if every currently viable modified quantum theory be debunk tomorrow,1
mathematical prerequisite for a qft course in graduate school,1
distance distortion in the mirror,1
problem visualize voltage and amperage,1
would   object on the other side of the universe to eachother eventually meet if  be a closed system,1
question about electromagnetic radiation,1
can  use antimatter collide with ordinary matter as rocket fuel if yes how far can  go on   nanogram milligram gram and kilogram,1
strong at mathematic but weak intuition in physics,1
could the expansion of space ever slow down,1
anyone ever read these two book,1
