title,category
understand the orbit of  solar system,1
ad cft explain the expand universe,1
top speed for escape gravity,1
 be have trouble understanding time distortion,1
recommendation for website youtube video for help in school,1
physics in undergraduate,1
how do black hole radiation exist,1
big bang and quantum entanglement,1
why be continuum mechanic so unpopular among modern day physicist,1
be every object in the universe exert gravitational force on every single other object,1
military technique,1
what do  as a society benefit from the knowledge about friction,1
 be depress,1
i be learn electricity and magnetism remotely what be the good tool kit in the market for a home lab to accompany this college course,1
aspire physicist   any advice or tip,1
what s  opinion belowi just get curious  be a high school student who love science but  be not sure if this question make sense,1
be life contradictory to entropy,1
how to get well at physics e amp m,1
basic heat radiation question,1
why be physicist and physics student so obsess with richard feynmans personality,1
what be non abelian group,1
look for help with physics lab,1
i feel kind of bad mentally with physics,1
physicist scientist be brainwash,1
what would happen if  start run in the same direction of velocity in a spaceship that travel at    the speed of light,1
physics behind a glowing bulb,1
be time the fourth dimension,1
i need help to calculate the air drag coefficient for  physics internal assessment,1
textbook   amp   resource thread    week  ,1
siphon,1
if an electron exist in a probability cloud and  can not determine  position until  interfere observe  how can  actually interact with  in the first place ie what be an interaction with a wave function,1
resource on renormalization group theory,1
test help,1
question about mass,1
where should i start with the math for physics,1
help understand    sigma,1
reach the limit of uncertainty principle,1
go short than the planck scale,1
resource for learn physics,1
be there a golden age dark age and rennaisance of general relativity,1
need career advice,1
follow up to the elegant universe by brian greene,1
question   be  possible to send energy to space and back,1
urgent advice   i have a test to take to become an assistant teacher at  goal university,1
how useful be primary school science anyways,1
 friend be convince that swimming in syrup be as fast as in water,1
limited career after msc physics in india,1
einstein theory of special relativity,1
how be antiproton create,1
look for physics book title,1
how important be build circuit,1
any female online physics tutor for a   grader,1
wave,1
amateur physics group,1
noob question about force,1
do physics in college purposely set  up for failure,1
physics to medical physic,1
what be the good math   concept   idk the correct word to know for physics,1
g force experience,1
what s potential energy,1
atmospheric pressure increase or,1
force in a turn,1
iphone in space,1
 be do math and i need help along with a what if question,1
slice a sound wave,1
hello do  have any answer to this question pls help    this be baout centripetal force,1
navier stoke analytical approximation literature,1
canonical transformation,1
bugs bunny in the house fall throw the air and jump out at the last minute,1
hubble time page time black hole    question,1
help with more easy dummy material to learn method physics studient,1
do the wavelength of a certain wave change when  pass from one medium to another,1
solution manual,1
which three book would  bring for a physics retreat,1
do anyone else feel like  do not deserve to be in physics,1
dark matter,1
anyone want to start a study group,1
e m research,1
speed be relative   which frame of reference should   can be use to tell that an object be travel at x   of the speed of light,1
fluorescence qm question,1
physics question thread    week  ,1
 hw be due in like   minute o_o,1
online course for the theoretical hobbyist that want to solve hilbert sixth problem,1
be the speed of sound ever high than the speed of light in a give material,1
e mcsquare,1
gauge block demonstration,1
what physics textbook do  recommend,1
 be search for good and updated paper about holography   any advice,1
 be confuse about distance time graphs,1
uncertainty help  ,1
what be the mass of mars,1
need help pls,1
build a bridge make of spaghetti,1
  why   matter possess   inertia  ,1
what be charge,1
sky in california,1
how do actio reactio not postulate a lack of free will,1
vacuum,1
doubt about work with unit of light,1
question to physics major,1
create physics youtube    twitch series,1
measure the speed of light in different environment,1
question   reverse butterfly effect two totally isolate system that have start with exact identical starting condition will  have identical progression,1
relationship between   and infinity,1
physics be just everyone say   look i know what s go to happen next  ,1
recommend graduate stat mech book,1
have time more than one dimension like space,1
electron hole concentration intrinsic material,1
science,1
do accelerator physicist write  own code or use the software only,1
i have a concept of a machine and i have a question,1
hey i need someone who know a thing or two about hydraulic and compress air to help  bust this idea i have,1
quick question about vector,1
why do a car have a hard time move leave or right when accelerate,1
think about major in physics sometime in the future be there somewhere i can find practice problem to see if this be something i can do,1
be there anyone who know this eqs origin,1
debate about something that have to do with physics    ,1
homework help,1
probability of find particle at a point,1
textbook   amp   resource thread    week  ,1
be there anything truly random in the universe that  be aware of,1
where do gravity get  energy from,1
kinematics,1
f ma    question on this,1
the multiplication of light from intersect light beam,1
dark graviton theory,1
do anyone else who can deal with non classical physics simply enjoy classical physics more,1
be physics question typically this bad in the medical field,1
where be a good place to learn calculus base physics,1
physics simulation,1
be electron electron scatter probabilistic,1
people who do a master in physics in europe,1
question on competitiveness and innovation for a physicist,1
mass vs momentum   question,1
i be tell i would be have a son next year  ,1
today be blame  on the large hadron collider day,1
if the universe be infinite will  still die,1
creat graphical simulation for scientific model,1
will boson star ever be observe,1
get into grad school for physics when to apply and should i even apply,1
positive or negative,1
any negative coefficient of thermal expansion liquid that become solid before  ,1
question for the passionate physicist   i want to genuinely learn physics,1
near accident what could have happen,1
can  create a black hole by accelerate an electron very close to the speed of light and hit  with a powerful laser beam,1
 first physics exam be in a week and i be pretty scared   how should i study for ,1
would the present exist in a non linear time,1
double neutrinoless beta decay question,1
be the earth flat maybe  depend,1
i have a theory,1
good educational resource for simulate physics,1
subreddit of physics or of censorship,1
do a dolphin actually cum as hard as a shotgun,1
book suggestion,1
black hole and the big bang,1
what be some physics relate thing i should know before  ug admission interview tomorrow,1
how to car use electricity gasoline to move,1
can someone recommend  a book to learn basic analytic mechanic in   week,1
  urgent   how do i find the center of datum point in a scatter graph,1
angle affect margin of error for a basketball shot,1
multiverse,1
do  think this kind of aero lift be possible,1
ionospheric earthquake precursor,1
graduate master in physics with different background in bachelors europe,1
struggle with find master s thesis,1
double slit experiment and human observation,1
do lightspeed travel and strong source of gravity work together to compound the effect on time,1
what kind of time relationship may a god have with the universe,1
echo of big bang,1
what math do  need to understand quantum physic,1
amateur physics theory,1
thermal,1
feel stupid,1
another physics theory,1
space numbchucks,1
ignorant physics,1
a line with multiple knot,1
 be write a screenplay about time but need some help with make the core idea make sense,1
get  interested in physics,1
quark,1
basic thermodynamic by gerry carrington,1
could galileo galilei prove  heliocentric model or be  just a strong hypothesis,1
what can a physicist do,1
why be  that normally  start rain after a thunder,1
 little toe    an idea about how gravity work,1
scare of career study,1
new to physics,1
formula for wave number,1
  d problem please help  solve ,1
potential graph,1
individual college level physics project,1
just want some advice,1
scientific paper,1
physics question thread    week  ,1
struggle with electromagnetism    math prerequisite,1
be  possible to correct shear transformation distortion use lense,1
einstein solution to  field equation,1
 be go to get blast but i need help and  search ability have fail ,1
do f    e q or be e    f q,1
the death star galaxy,1
think experiment about velocity,1
momentum and velocity question i think,1
hypothesis   wheeler idea of one electron universe automatically lead to paulis exclusion principle   coz if all electron be the same electron move back   amp   forth in time then observe two at the same location in spacetime be naturally impossible,1
what be a job for a physicist,1
math physics be need to learn twistor theory,1
how do i approach explore  research interest in   year of  undergrad i aim to get into an acclaimed graduate program for physics but i think i need to make  research interest clear beforehand,1
high school student with a teacher that do not teach,1
if the movement and the speed of the universe depend on creature observation then what be the true speed of the universe,1
question about calculation of number of atom,1
do zombie poo,1
who be the most underrated physics scientist among history under look,1
 odd alien theory,1
coordinate system or triangulation,1
what s the good way to get into physics,1
what do this number represent in time measure and stuff,1
native question about the meissner effect,1
physics book for pleasure,1
just a question,1
what be a good program to create example graphs,1
how would light be handle if shone at a flat surface coat in tiny densely pack spherical mirror,1
how to take a more physical rather than mathematical approach,1
what be negative charge,1
potential energy,1
look for good physics show documentary,1
physics experiment help,1
resonance,1
question about quantum tunneling,1
how fast can  really travel,1
can someone explain fluid velocity and how  affect pressure   amp   flow rate please,1
 mom leave  and  sibling for  boyfriend,1
be  theoretically possible to jetpack out of a black hole,1
help,1
physics of a kick with a change in gravitational force,1
what be  favorite fact about physics what blow  mind what do  think be really cool,1
just curious what be the limitation to what  can build in term of height,1
how would i work out the next part of this   equation,1
i really need help call ,1
dalembert principle what be  good for,1
wave function,1
when a system be in state of equilibrium can  have multiple eigen energy associate with  context   reif sec  ,1
music  listen while do physics,1
try to figure out pressure between two surface like water and air where  also take height in consederation,1
anyone feel general relativity to be a bit tricky when start to read,1
i will ask again,1
speed of light in water or glass,1
  question   if  be hold a shopping bag and i lift  carefully do this increase the force on the handle,1
be motion different for dark matter what do the datum suggest,1
how do a neutron interact with atomic electron,1
how do  get into physics research field,1
self teach quantum mechanic and general relativity,1
what if the universe be not really expand,1
complete absence of movement,1
question   fast gear to ultra slow gear to fast gear,1
question   moon in the tide relation through time,1
how be the speed of light and time travel connect,1
physics question true or false,1
project idea for classical mechanic use matlab,1
help need with qft and vacuum energy,1
question about the   twin paradox  ,1
reversible heat in the change of entropy,1
quick thought will travel at the speed of light make  surrounding brighter or dark,1
photoelectric effect but with a twist,1
  vector transformation,1
do human also exert pressure on the water while underwater,1
tension in a string,1
note from a new physics lover,1
momentum question,1
fluid researcher here    how hard be combustion and flame compare to say journal of fluid mechanic,1
at what frequency hz be human unable to detect blinking,1
look to learn nuclear decay any advice,1
how can the big bang which suppose to contain all matter energy in the universe explode instead of contract at the beginning,1
how to know if  fundamental in applied physics or physic in general be good,1
a profound idea for the potential use of negative mass matter,1
gravity,1
how to define temperature,1
discussion with a friend about force of constraint,1
saturns moon titan,1
if the universe be create from big bang which be a dense blob of matter be not  a black hole like at the beginnig how can  explode instead of contract like a black hole,1
please help ,1
what be friction if  be a force then what be the direction when the body be static and why  be u n   u   coefficient of friction do  get  experimentally or theoretically,1
need some advice,1
  and  claim that everything be information,1
textbook   amp   resource thread    week  ,1
the relationship between precision and uncertainty,1
some paper to read,1
be  at all possible that dark energy be just repulsive gravity,1
electronic scale reaction time help,1
a black hole gravity,1
what error be schrodinger try to point out with  thought experiment,1
need help for an elaborate party game   need list of detector vision and science experiment,1
minigame that use emf emf generator,1
street light interference,1
equation for boil water w time,1
how do  think someone become a good physicist,1
how do spin impact the bounce of a tennis ball,1
question about the universe,1
can there be motion if there be not change in motion,1
light intensity to heat calculation,1
switching os for astrophysic    advice need,1
hypercentric optics,1
a question about the planck length,1
what be significant figure digit,1
vacuum chamber question,1
physics question  have always have and nobody have be able to explain to ,1
an old question hard to understand,1
ldrs not a homework question,1
harvard physics phd,1
research paper topic   help,1
large feature of the microwave sky at distance of over   billion ly appear to be align with both the motion and orientation of the solar system   be this due to systematic error in process contamination of result by local effect or an unexplained violation of the copernican principle,1
would  be possible to create a wormhole use black hole,1
how do the unruh effect create particle,1
if  compare the centimetre scale from now and one from the past would  be of different length,1
how do a rindler horizon mix certain positive and negative vibrational mode,1
bachelor thesis   advice need,1
psychological and philosophical difficulty when try to wrap brain around the implication of modern physics,1
predict quantum randomness,1
  q   good newsletter to subscribe for keep in touch with the late development,1
effect of artificial gravity on time,1
please can somebody help  for question pls,1
how do  picture energy,1
sorry if this sound dumb but,1
help ,1
what be some famous scientist in the time department,1
topic for a presentation in applied particle physics,1
time dilation and contraction,1
han bethe sum up the human condition in the most perfect way possible,1
how far would a bowling ball go down an unlimited length lane,1
how do a leverand torque be explain in atomic scale,1
good acoustic simulation tool relatively small space,1
revive dead battery question,1
how large be the gap or knowledge between undergrad and grad,1
would a planar discontinuity in a gravitational field kill  dnd character,1
why do elon musk say that the question be hard than the answer   conceptual,1
which physicist get  really interested in physics engineering during high school,1
physics graduate school advice,1
object leash by lever,1
self teaching physics,1
the role of worked solution in study physics as a graduate student,1
need help for this pressure exercise,1
life philosophy law of physics,1
today be  first class of modern physics,1
i be thirteen please correct  if this have be disproven,1
question re force,1
try to wrap  head around gravity in,1
newton experiment regard the colour composition of sunlight,1
physics question thread    week  ,1
twin paradox vs the shape of the universe,1
anti matter bomb versus strange matter bomb,1
find someone who be willing to write a physics handout with ,1
physics be break  spirit,1
hypercentric optics,1
anyone know any good free website youtube channel where  can learn strength of material,1
what s a good template for a good physics resume,1
where to start,1
be there any softeware i could use to simulate thing like magnet and electric current as well as build physical stuff like crackshaft or gear,1
anyone wanna mod r physicslecture,1
anyone wanna mod wanna mod r physicslecture,1
anyone wanna mod r physicsvideos,1
what evidence be there of the graviton particle,1
i have a hypothetical question about light and gravity,1
software for simulate electric force circuit etc,1
could  derive boltzmann s constant via monte carlo simulation,1
ak lectures vs   michel van biezen,1
tips tricks advice,1
how do reflection work at a sub atomic level,1
quantum field,1
hydrodynamic want to track water flow through a closed system,1
fast than light travel use a lever stick,1
time question,1
  degree prism glass,1
circular rotation on evelyn spectrum    if provoke,1
if space be curved be there a heavy enough object to rip ,1
what be the difference in different type of physics,1
look for physics research,1
avatar physics,1
artisanal formula poster,1
new online resource,1
what happen when a photon collide with a photon of inverse wave lenght property,1
i swear to god i be not troll,1
would physics work in other dimension,1
be  possible for an object with mass in space to be in a fix location relative to all point in the universe,1
relativity,1
theoretically be  possible to use electricity for propulsion in space,1
what s the physical meaning of energy density for electromagnetic field,1
quantum theory for statistician,1
math course as a physics undergrad,1
what s the physical meaning of energy density for electromagnetic field,1
conformal cyclical cosmology,1
be age   too late to start physics degree,1
first time take physics class   need advice,1
i can not understand the most basic concept of quantum physics,1
atomic physics simulation software,1
transverse doppler effect problem morin,1
help a passionate person study physics,1
could  be that there be no dark energy but that void space have a sort of refractive index,1
 be consider join a club at  school call kinetic model club,1
magnetic field calculation,1
physics major useful,1
gravity mass   amp   time dilation,1
please help   how can a layman such as  acquire the tool to investigate physics question on  own,1
help with well depth,1
a brief history of time for astrophysic,1
how much force a bullet need to kill,1
laptop notebook suggestions    first year university physics major,1
differentiation of source of gravitational wave,1
what book would  guy recommend for a   year old want to learn physics,1
interesting book   quantum physics without quantum philosophy,1
space expansion,1
so i learn about a few topic on physics and have a few qns     ,1
collision with fluid,1
textbook   amp   resource thread    week  ,1
i have a question about the higgs field,1
be there any high quality online free physics certification i can get to strengthen  cv,1
can someone explain the theory of quantum immortality to ,1
maxwell equation to   year old boy    how to explain,1
do anyone get a word doc of equation build use equation editor that one could just copy and paste,1
undergrad in math physics,1
do direct band gap occur in nature,1
what happen to the post about the clock problem,1
what exactly be the difference between electroluminescence and ole light also why be ole able to use organic material while lead be not,1
online resource,1
good introductory physics i ii textbook option for new student,1
newton of force,1
which be  favorite youtube channel and webpage physics,1
antiproton antiproton collision,1
which website professor physicist frequently visit,1
ping pong ball with water inside experiment,1
a new subreddit people from this community will probably enjoy,1
how do  know that a black hole be not just an insanely dense neutron star,1
relationship between increase in concentration and surface tension of deionized water,1
home smartphone experiement,1
anti gravity thought,1
will a physics minor do  any good as a medical social worker,1
 be   and want a career in high energy particle physics,1
be  possible to explain the stability of a spin top without invoke angular momentum torque,1
do information travel fast than speed of light violate special relativity,1
question for all  physicist   ,1
need some help i would truly appreciate ,1
technology development vs experiment,1
decibel help,1
please help,1
please help  clarify regard on sig fig,1
please help  clarify regard on sig fig,1
have anyone else work with snspd superconducte nanowire single photon detector,1
i want to get study physics in top university i   e   harvard yale ivy leageu etc   but do not know how   from malaysia,1
i do not know if this theory be real or what,1
confusion regard quantum entanglement,1
willing to pay for a tutor in physics   amp   a few math course if  can help,1
orbit,1
do mirror reflect other part of the light spectrum the same way  reflect visible light,1
how risky be  to pursue a career in computational physics,1
what should i do,1
question about coulomb law,1
why do not  kill ,1
thought on high spacial dimension,1
quantum computer optical computer and the   demise of moore s law,1
transferral of energy from  body to the outside world equation,1
advice and thought on do a phd,1
channel for study physics,1
physics question thread    week  ,1
i need help with a question in  book,1
percentage difference or percentage error,1
opinion about textbook on wave,1
i urgently sincerely need  advice,1
why two oppose stand wave do not destroy each other,1
how do coulomb constant become k   ,1
how do  deal with be overwhelmed in university,1
physics essentials textbooks book,1
phy chapter   heat and gas question,1
launch velocity,1
book recommendation for revise classical mechanic,1
fun book on physics,1
do the mpemba effect affect liquid other than water,1
be academia a realistic career path in australia,1
hello people of reddit,1
subfield of nuclear physic,1
anyone have any recommendation for interesting book,1
if e   would not that mean that everything be happen at once,1
r physics look for someone consult on a series,1
apply for a master degree in particle physics,1
help with time dilation formula,1
why a reduction in velocity cause an object to deorbit,1
need physics book,1
look to hire for physics help,1
question on muon,1
how can hole conduct current in a semiconductor,1
surface tension of water,1
have anyone ever try to solve problem in physics with a numbering system other than base,1
how do pressure change in an adiabatic process if pressure be not allow to be change in an isolated system,1
how do hawk radiation with vacuum fluctuation work,1
space twin paradox,1
help with a question  be stick on,1
how long do  take to get a publication in physics,1
what should i do,1
go into physics   with a really bad professor any advice on how to proceed,1
what give with the quantum physocs reddit be lock build an entangler,1
be math undergrad research useful for physics grad school,1
help  smol brain,1
mini theory high school student do not be too harsh,1
be  universe inside a black hole,1
heating water,1
mass loss in energy equation of a liquid,1
gravity,1
electric discharge,1
game question   what s more dangerous diving from   foot high into   foot of water or   foot into   foot of water,1
what s  call when  force somete between two object until  launce,1
do randomness actually exist,1
other universe structure,1
book to practice physics equation,1
can anyone suggest  a good reference book for high school physics which will give the good insight of the topic of high school,1
physics podcast recommendation,1
get into physics,1
why be  that i can understand the material and what s go on but when i see an exam problem i have no idea where to start magnetism lrc circuit  wave what should i do to improve,1
how far can  push dirt,1
can someone explain this to ,1
force,1
why do the universe work in the way  do,1
wacky physics theory from a non physicist,1
t i m e,1
i notice something interesting and then make a question around  so  be wonder if  even solvable within reason   here that question,1
what kind of college do  have to go to for a job in physics,1
can i do engineering after physics,1
question about e mc   as  relate to the slowing of particle in the higgs field,1
can  violate third law of motion,1
doubt about ra,1
electric current thermodynamic homework help   guidance require,1
what be the subsonic version of rocket under over expansion,1
look for a paper website write up of a specific experiment,1
textbook   amp   resource thread    week  ,1
